{
  "occurrence_id": "verona-colei-che-non-si-deve-amare-0bd9dd71e718a28a",
  "core_classification": {
    "label_support": {
      "truth_conditional": 4,
      "performative": 0,
      "exclamatory_reflexive": 0,
      "other": 0
    },
    "confidence": 0.97,
    "analysis": "The embedded “t’amavo” (“I loved you”) presents the speaker’s past, continuing love for Lora as true. It serves as an avowal and as a premise in a rhetorical challenge, not as a relational undertaking or a reflex-like expressive discharge.",
    "ambiguity": "The imperfect tense may suggest an enduring past state and does not by itself establish whether the love continues at the speaking moment."
  },
  "other_diagnosis": {
    "tpe_failure": null,
    "core_not_context": null
  },
  "utterance_status": {
    "status": "direct",
    "description": "A first-person love avowal embedded in a relative clause within the speaker’s direct, rhetorically questioning address to Lora."
  },
  "contextual_interpretation": "The speaker invokes his painful love and his desperate flight to avoid harming Lora as evidence in an incredulous or defensive rhetorical question. The repetition of “io, che…” and the emotionally charged description intensify the avowal, but do not independently make the words an expressive/reflex-like discharge or a commitment.",
  "evidence": [
    {
      "evidence_id": "e1",
      "source": "local_text",
      "quotation_or_description": "“io, che t’amavo con tanta pena” (“I, who loved you with such pain”)",
      "supports": "Strong truth-conditional support: the speaker explicitly presents painful past love for Lora as a fact.",
      "confidence": 0.99
    },
    {
      "evidence_id": "e2",
      "source": "local_text",
      "quotation_or_description": "“io, che fuggivo disperatamente per non farti male?” (“I, who fled desperately so as not to hurt you?”)",
      "supports": "Frames the avowal as part of a defensive or incredulous argument about the speaker’s conduct; this supplies context and intensity but no undertaking force.",
      "confidence": 0.96
    },
    {
      "evidence_id": "e3",
      "source": "supplied_metadata",
      "quotation_or_description": "The form is identified as affirmative imperfect, past tense/aspect, and main-or-embedded.",
      "supports": "Confirms that the core expression is an affirmative, past-oriented embedded avowal rather than a promise or hypothetical statement.",
      "confidence": 0.98
    }
  ],
  "background_knowledge": {
    "used": false,
    "familiarity": "none",
    "confidence": null,
    "contribution": null
  },
  "ontology_assessment": {
    "fit": "natural",
    "diagnosis": "T naturally captures the core force as an avowal of a loving state. The rhetorical and emotionally intense framing is contextual and leaves no important core-force remainder outside T/P/E.",
    "candidate_recurrent_dimension": null
  },
  "notes": null
}
