{
  "occurrence_id": "dumas-fils-la-dame-aux-camelias-85963bb66685",
  "core_classification": {
    "label_support": {
      "truth_conditional": 4,
      "performative": 0,
      "exclamatory_reflexive": 0,
      "other": 0
    },
    "confidence": 0.93,
    "analysis": "The speaker directly presents love as the true reason for something: “Parce que je vous aime” functions primarily as an emphatic avowal of an emotional state. Nothing in the supplied text establishes a commitment or relational undertaking. The exclamation and “pardieu” intensify the delivery but do not independently show that “je vous aime” is a reflex-like expressive discharge.",
    "ambiguity": "The very short extract leaves the larger conversational purpose unspecified, but this does not materially undermine the dominant truth-conditional classification."
  },
  "other_diagnosis": {
    "tpe_failure": null,
    "core_not_context": null
  },
  "utterance_status": {
    "status": "direct",
    "description": "A directly spoken love avowal embedded in the causal reply “Parce que je vous aime, pardieu!”"
  },
  "contextual_interpretation": "The utterance answers an implicit question with love as the speaker’s reason. “Pardieu!” and the exclamation mark convey forceful, emotionally emphatic delivery, but intensity alone neither creates performative commitment nor establishes expressive/reflexive core force.",
  "evidence": [
    {
      "evidence_id": "E1",
      "source": "local_text",
      "quotation_or_description": "“Parce que je vous aime, pardieu!”",
      "supports": "The causal construction presents the speaker’s love as an asserted explanation, strongly supporting T.",
      "confidence": 0.98
    },
    {
      "evidence_id": "E2",
      "source": "local_text",
      "quotation_or_description": "The utterance ends with “pardieu!” and an exclamation mark.",
      "supports": "This supports emphatic delivery but, without evidence of blurting or reflex-like production, does not independently support E.",
      "confidence": 0.95
    },
    {
      "evidence_id": "E3",
      "source": "supplied_metadata",
      "quotation_or_description": "The occurrence is located in Chapter XXIV of Alexandre Dumas fils’s La Dame aux camélias.",
      "supports": "Identifies the utterance as literary dialogue in the named work; the supplied metadata adds no evidence of a distinct undertaking or nonstandard core force.",
      "confidence": 0.99
    }
  ],
  "background_knowledge": {
    "used": false,
    "familiarity": "none",
    "confidence": null,
    "contribution": null
  },
  "ontology_assessment": {
    "fit": "natural",
    "diagnosis": "T naturally captures the core utterance as an emphatic avowal offered as a reason. Delivery-related intensity can remain contextual, with no residual pressure requiring P, E, or O.",
    "candidate_recurrent_dimension": null
  },
  "notes": null
}
