{
  "occurrence_id": "bang-ved-vejen-7ac95aa4f5375b71",
  "core_classification": {
    "label_support": {
      "truth_conditional": 4,
      "performative": 0,
      "exclamatory_reflexive": 0,
      "other": 0
    },
    "confidence": 0.93,
    "analysis": "Within the quoted song lyric, “Jeg elsker dig” straightforwardly presents the lyric persona’s love for Valdemar as true. It supplies no distinct relational undertaking, and neither the singing nor the preceding exclamatory vocative establishes reflex-like expressive force independently of an emotionally presented avowal.",
    "ambiguity": "The actual singers are revoicing lyrics rather than necessarily avowing their own love; the high T score applies to the represented lyric utterance, not to their personal sincerity."
  },
  "other_diagnosis": {
    "tpe_failure": null,
    "core_not_context": null
  },
  "utterance_status": {
    "status": "quoted_or_revoiced",
    "description": "A directly reproduced line sung by the group called the “Nightingales,” voicing a lyric persona’s declaration to Valdemar."
  },
  "contextual_interpretation": "The song is audible in the hotel courtyard and is followed by Bai’s detached comment, “De holder ud” (“They keep at it”). Its conventional declaration of love contrasts narratively with the largely unspoken intimacy between Katinka and Huus, but that juxtaposition does not alter the lyric’s dominant truth-conditional force or create performative or reflex-like force.",
  "evidence": [
    {
      "evidence_id": "e1",
      "source": "local_text",
      "quotation_or_description": "“Oh du--min Valdemar! / Jeg elsker dig....”",
      "supports": "The named addressee and explicit present-tense declaration strongly support T as an avowal within the lyric voice.",
      "confidence": 0.99
    },
    {
      "evidence_id": "e2",
      "source": "local_text",
      "quotation_or_description": "“‘Nattergalene’ sang højt ud i Gaarden” immediately introduces the reproduced lines.",
      "supports": "Establishes that the utterance is a sung, quoted or revoiced lyric rather than a direct personal declaration by a participant in the carriage scene.",
      "confidence": 0.99
    },
    {
      "evidence_id": "e3",
      "source": "local_text",
      "quotation_or_description": "Bai responds, “De holder ud” after the lyric.",
      "supports": "Confirms that the song continues as an overheard performance; it does not supply evidence of a commitment or reflex-like verbal discharge.",
      "confidence": 0.94
    }
  ],
  "background_knowledge": {
    "used": false,
    "familiarity": "none",
    "confidence": null,
    "contribution": null
  },
  "ontology_assessment": {
    "fit": "natural",
    "diagnosis": "T naturally captures the represented lyric avowal. The performance framing and emotional styling are adequately handled as context and do not reveal a core force omitted by T/P/E.",
    "candidate_recurrent_dimension": null
  },
  "notes": null
}
