{
  "occurrence_id": "sand-la-mare-au-diable-7ba1f4516fb0cdd9",
  "core_classification": {
    "label_support": {
      "truth_conditional": 4,
      "performative": 2,
      "exclamatory_reflexive": 2,
      "other": 0
    },
    "confidence": 0.9,
    "analysis": "Germain’s “Vois, je t’en prie, comme je t’aime” directly avows his present love for Marie, giving T maximal support. It occurs within an explicit marriage proposal and declaration of willingness to give himself to her, so it participates in a relational undertaking, though the highlighted clause itself primarily states his feeling rather than independently making the commitment. The narration positively presents his speech as released by irresistible tenderness—his tongue is ‘loosened as though by a miracle’—which supplies moderate independent E support, despite the extended and partly reasoned form of his appeal.",
    "ambiguity": "The main uncertainty concerns how much of the surrounding proposal’s undertaking force belongs to the highlighted avowal itself, and whether the affect-driven narrative framing makes this particular clause partly expressive rather than merely a passionate assertion."
  },
  "other_diagnosis": {
    "tpe_failure": null,
    "core_not_context": null
  },
  "utterance_status": {
    "status": "direct",
    "description": "Germain directly addresses Marie during an extended declaration of love and proposal of marriage."
  },
  "contextual_interpretation": "The avowal is sincere as presented and forms part of Germain’s attempt to persuade Marie to accept him as her husband. His speech combines emotional disclosure with practical arguments about his age, security, children, and suitability. Marie hears him but distinguishes affection from romantic inclination and initially rejects the proposed match. The courtship setting strengthens limited P support, while the narrator’s account of tenderness overcoming Germain’s shame independently supports some expressive/reflexive force.",
  "evidence": [
    {
      "evidence_id": "e1",
      "source": "local_text",
      "quotation_or_description": "“Vois, je t’en prie, comme je t’aime” (‘See, I beg you, how I love you’).",
      "supports": "A direct, present avowal of Germain’s loving emotional state, strongly supporting T.",
      "confidence": 0.99
    },
    {
      "evidence_id": "e2",
      "source": "local_text",
      "quotation_or_description": "Germain says that if Marie accepted him as her husband, nothing could prevent him from giving himself to her, and that he would immediately swear to spend his life doing her wishes.",
      "supports": "The surrounding speech is an explicit marital proposal and prospective self-commitment, giving the highlighted avowal some P force in context.",
      "confidence": 0.97
    },
    {
      "evidence_id": "e3",
      "source": "local_text",
      "quotation_or_description": "“des mouvements de tendresse irrésistible s’emparant de son cœur… Sa langue se délia comme par miracle, et toute honte cessant” (‘impulses of irresistible tenderness… took possession of his heart; his tongue was loosened as though by a miracle, and all shame ceased’).",
      "supports": "Positive narrative evidence that affect itself releases the declaration, supporting E independently of mere emotional intensity.",
      "confidence": 0.95
    },
    {
      "evidence_id": "e4",
      "source": "local_text",
      "quotation_or_description": "Marie replies that Germain speaks honorably and truly but that her heart does not incline toward him romantically.",
      "supports": "Confirms that she understands the speech as a serious romantic avowal and marriage proposal rather than as rote or nonsemantic language.",
      "confidence": 0.96
    }
  ],
  "background_knowledge": {
    "used": false,
    "familiarity": "none",
    "confidence": null,
    "contribution": null
  },
  "ontology_assessment": {
    "fit": "natural",
    "diagnosis": "T captures the central avowal, P captures its limited participation in the surrounding marriage undertaking, and E captures the narrator’s explicit presentation of speech released by overwhelming tenderness. No important aspect of the core force remains outside T/P/E.",
    "candidate_recurrent_dimension": null
  },
  "notes": null
}
